{
  "data_export_run_id": "34233912-c91f-4dc9-bfed-c10d16be26af",
  "scheduled_data_export_id": "4ab082f2-864e-4bcf-bc17-75664a25f2e1",
  "created_at": "2019-03-09T08:07:59.044Z",
  "completed_at": "2019-03-09T08:08:02.178Z",
  "status": "complete",
  "file_id": "74ce9562-4242-11e9-904a-7b14ba20f082"
}